{
  "annotation_schema_version": 2,
  "candidate_set_sha256": "e6089bcdf90ec249cab3817c9a4da8cc25217f6bb3cb99f345ac5f774909d73d",
  "heldout_sample_sha256": "d71ab1aa31ac0af0b7631e7d1e75c37f61922c5452c380ae32af3fd4b22e6f76",
  "annotator_id": "openai-codex/gpt-5.6-luna:xhigh:feedback-v2-production:batch-031",
  "annotations": [
    {
      "candidate_unit_id": "thinkingcap/adaptix-name-mapping-aliases/rep1/tool-call-160",
      "candidate_disposition": "negative_feedback",
      "observation_class": "negative_semantics_with_zero_status",
      "action_purpose": "repository_validation",
      "next_response_label": "targeted_investigation",
      "window_outcome": "progressed",
      "relevant_change_observed": "yes",
      "post_change_validation_scope": "same_scope",
      "plan_revision": "local_adjustment",
      "confidence": "high",
      "uncertainty_reasons": [],
      "evidence_summary": "The provider test reported failures, then a narrower test, code edit, and same-file rerun occurred; failures remained."
    },
    {
      "candidate_unit_id": "thinkingcap/adaptix-name-mapping-aliases/rep1/tool-call-161",
      "candidate_disposition": "negative_feedback",
      "observation_class": "negative_semantics_with_zero_status",
      "action_purpose": "repository_validation",
      "next_response_label": "corrective_change",
      "window_outcome": "progressed",
      "relevant_change_observed": "yes",
      "post_change_validation_scope": "broader_scope",
      "plan_revision": "local_adjustment",
      "confidence": "high",
      "uncertainty_reasons": [],
      "evidence_summary": "The focused test failed; the subject edited crown hashing and reran the broader provider test, which still reported failures."
    },
    {
      "candidate_unit_id": "thinkingcap/adaptix-name-mapping-aliases/rep1/tool-call-163",
      "candidate_disposition": "negative_feedback",
      "observation_class": "negative_semantics_with_zero_status",
      "action_purpose": "repository_validation",
      "next_response_label": "corrective_change",
      "window_outcome": "progressed",
      "relevant_change_observed": "yes",
      "post_change_validation_scope": "none",
      "plan_revision": "local_adjustment",
      "confidence": "high",
      "uncertainty_reasons": [],
      "evidence_summary": "The broader test still failed, after which two loader-generation edits were applied without a subsequent validation run."
    },
    {
      "candidate_unit_id": "thinkingcap/adaptix-name-mapping-aliases/rep1/tool-call-164",
      "candidate_disposition": "negative_feedback",
      "observation_class": "negative_semantics_with_zero_status",
      "action_purpose": "repository_validation",
      "next_response_label": "corrective_change",
      "window_outcome": "progressed",
      "relevant_change_observed": "yes",
      "post_change_validation_scope": "broader_scope",
      "plan_revision": "local_adjustment",
      "confidence": "high",
      "uncertainty_reasons": [],
      "evidence_summary": "The targeted test failed; loader-generation edits followed, then the broader provider test still showed failures."
    },
    {
      "candidate_unit_id": "thinkingcap/adaptix-name-mapping-aliases/rep1/tool-call-167",
      "candidate_disposition": "negative_feedback",
      "observation_class": "negative_semantics_with_zero_status",
      "action_purpose": "repository_validation",
      "next_response_label": "targeted_investigation",
      "window_outcome": "progressed",
      "relevant_change_observed": "yes",
      "post_change_validation_scope": "same_scope",
      "plan_revision": "local_adjustment",
      "confidence": "high",
      "uncertainty_reasons": [],
      "evidence_summary": "The full provider test failed; a narrowed failing case was examined, a loader edit applied, and the full test rerun with failures."
    },
    {
      "candidate_unit_id": "thinkingcap/adaptix-name-mapping-aliases/rep1/tool-call-168",
      "candidate_disposition": "negative_feedback",
      "observation_class": "negative_semantics_with_zero_status",
      "action_purpose": "repository_validation",
      "next_response_label": "corrective_change",
      "window_outcome": "progressed",
      "relevant_change_observed": "yes",
      "post_change_validation_scope": "broader_scope",
      "plan_revision": "local_adjustment",
      "confidence": "high",
      "uncertainty_reasons": [],
      "evidence_summary": "The focused test failed; the subject edited field generation, reran the broader suite, and then inspected another failing case."
    },
    {
      "candidate_unit_id": "thinkingcap/adaptix-name-mapping-aliases/rep1/tool-call-170",
      "candidate_disposition": "negative_feedback",
      "observation_class": "negative_semantics_with_zero_status",
      "action_purpose": "repository_validation",
      "next_response_label": "targeted_investigation",
      "window_outcome": "progressed",
      "relevant_change_observed": "yes",
      "post_change_validation_scope": "same_scope",
      "plan_revision": "local_adjustment",
      "confidence": "high",
      "uncertainty_reasons": [],
      "evidence_summary": "The full provider test failed; a focused case was rerun, field-generation code changed, and the full test still reported failures."
    },
    {
      "candidate_unit_id": "thinkingcap/adaptix-name-mapping-aliases/rep1/tool-call-171",
      "candidate_disposition": "negative_feedback",
      "observation_class": "negative_semantics_with_zero_status",
      "action_purpose": "repository_validation",
      "next_response_label": "corrective_change",
      "window_outcome": "progressed",
      "relevant_change_observed": "yes",
      "post_change_validation_scope": "broader_scope",
      "plan_revision": "local_adjustment",
      "confidence": "high",
      "uncertainty_reasons": [],
      "evidence_summary": "The exception-collection test failed; the subject edited field generation and reran the broader provider test, which remained failing."
    },
    {
      "candidate_unit_id": "thinkingcap/adaptix-name-mapping-aliases/rep1/tool-call-173",
      "candidate_disposition": "negative_feedback",
      "observation_class": "negative_semantics_with_zero_status",
      "action_purpose": "repository_validation",
      "next_response_label": "targeted_investigation",
      "window_outcome": "progressed",
      "relevant_change_observed": "yes",
      "post_change_validation_scope": "none",
      "plan_revision": "local_adjustment",
      "confidence": "high",
      "uncertainty_reasons": [],
      "evidence_summary": "The full provider test failed; a focused optional-key test failed, then loader code changed without a later validation run."
    },
    {
      "candidate_unit_id": "thinkingcap/adaptix-name-mapping-aliases/rep1/tool-call-174",
      "candidate_disposition": "negative_feedback",
      "observation_class": "negative_semantics_with_zero_status",
      "action_purpose": "repository_validation",
      "next_response_label": "targeted_investigation",
      "window_outcome": "progressed",
      "relevant_change_observed": "yes",
      "post_change_validation_scope": "none",
      "plan_revision": "local_adjustment",
      "confidence": "high",
      "uncertainty_reasons": [],
      "evidence_summary": "The focused optional-key test failed; the subject inspected loader code and applied a relevant edit, without validating it afterward."
    },
    {
      "candidate_unit_id": "thinkingcap/adaptix-name-mapping-aliases/rep1/tool-call-183",
      "candidate_disposition": "negative_feedback",
      "observation_class": "command_nonzero",
      "action_purpose": "setup_or_commit",
      "next_response_label": "corrective_change",
      "window_outcome": "recovered",
      "relevant_change_observed": "no",
      "post_change_validation_scope": "not_applicable",
      "plan_revision": "local_adjustment",
      "confidence": "high",
      "uncertainty_reasons": [],
      "evidence_summary": "The commit failed for missing author identity; local git identity was configured, the commit succeeded, and tests then passed."
    },
    {
      "candidate_unit_id": "thinkingcap/adaptix-name-mapping-aliases/rep2/tool-call-36",
      "candidate_disposition": "negative_feedback",
      "observation_class": "tool_application_rejection",
      "action_purpose": "mutation",
      "next_response_label": "targeted_investigation",
      "window_outcome": "recovered",
      "relevant_change_observed": "yes",
      "post_change_validation_scope": "none",
      "plan_revision": "local_adjustment",
      "confidence": "high",
      "uncertainty_reasons": [],
      "evidence_summary": "The edit text did not match; the subject inspected the target and then applied a corrected edit successfully."
    },
    {
      "candidate_unit_id": "thinkingcap/adaptix-name-mapping-aliases/rep2/tool-call-66",
      "candidate_disposition": "negative_feedback",
      "observation_class": "negative_semantics_with_zero_status",
      "action_purpose": "repository_validation",
      "next_response_label": "targeted_investigation",
      "window_outcome": "progressed",
      "relevant_change_observed": "yes",
      "post_change_validation_scope": "different_scope",
      "plan_revision": "local_adjustment",
      "confidence": "high",
      "uncertainty_reasons": [],
      "evidence_summary": "The name-layout suite failed; the test file was inspected and edited, followed by passing tests in a different facade suite."
    },
    {
      "candidate_unit_id": "thinkingcap/adaptix-name-mapping-aliases/rep2/tool-call-69",
      "candidate_disposition": "negative_feedback",
      "observation_class": "negative_semantics_with_zero_status",
      "action_purpose": "repository_validation",
      "next_response_label": "corrective_change",
      "window_outcome": "progressed",
      "relevant_change_observed": "yes",
      "post_change_validation_scope": "none",
      "plan_revision": "local_adjustment",